{
  "schema_version": "1.0.0",
  "repository_url": "https://github.com/agentscope-ai/agentscope",
  "release_tag": "v2.0.5",
  "commit_hash": "27b6a0d2a2afedf53462c9a2add33932d54b2d20",
  "python_version": ">=3.11",
  "core_dependencies": {
    "aioitertools": "*",
    "anthropic": "*",
    "dashscope": "*",
    "docstring_parser": "*",
    "filetype": "*",
    "json5": "*",
    "json_repair": "*",
    "mcp": "<2.0.0",
    "httpx": "*",
    "numpy": "*",
    "openai": "*",
    "python-datauri": "*",
    "opentelemetry-api": ">=1.39.0",
    "opentelemetry-sdk": ">=1.39.0",
    "opentelemetry-exporter-otlp": ">=1.39.0",
    "opentelemetry-semantic-conventions": ">=0.60b0",
    "python-socketio": "*",
    "shortuuid": "*",
    "python-frontmatter": "*",
    "jinja2": "*",
    "aiofiles": "*",
    "tree_sitter": "*",
    "tree_sitter_bash": "*",
    "jsonschema": "*",
    "tzdata": "*"
  },
  "generated_date": "2026-07-28",
  "generated_by": "speckit-implement script (AST static analysis)"
}
